{
    "$schema": "https://json-schema.org/draft/2020-12/schema",
    "$id": "./schemas/config.schema.json",
    "title": "ss.ai config",
    "type": "object",
    "additionalProperties": false,
    "properties": {
        "$schema": {
            "type": "string"
        },
        "http": {
            "type": "object",
            "additionalProperties": false,
            "properties": {
                "host": {
                    "type": "string"
                },
                "port": {
                    "type": "number"
                }
            }
        },
        "logger": {
            "type": "object",
            "additionalProperties": false,
            "properties": {
                "level": {
                    "enum": [
                        "debug",
                        "info",
                        "warn",
                        "error"
                    ]
                },
                "logFilePath": {
                    "type": "string"
                },
                "includeSourceLocation": {
                    "type": "boolean"
                },
                "includeStackTrace": {
                    "type": "boolean"
                }
            }
        },
        "runtimeFiles": {
            "type": "object",
            "additionalProperties": false,
            "properties": {
                "tempDir": {
                    "type": "string"
                },
                "userDataDir": {
                    "type": "string"
                }
            }
        },
        "agent": {
            "type": "object",
            "additionalProperties": false,
            "properties": {
                "timeoutMs": {
                    "type": "number"
                },
                "maxRetries": {
                    "type": "number"
                }
            }
        },
        "models": {
            "type": "object",
            "minProperties": 1,
            "additionalProperties": {
                "type": "object",
                "required": [
                    "apiUrl"
                ],
                "properties": {
                    "provider": {
                        "type": "string"
                    },
                    "apiUrl": {
                        "type": "string"
                    },
                    "apiKey": {
                        "type": "string"
                    },
                    "model": {
                        "type": "string"
                    },
                    "availableModels": {
                        "type": "array",
                        "items": {
                            "type": "string"
                        }
                    }
                }
            }
        }
    }
}